{
  "kind": "tree-manifest",
  "schemaVersion": "1.0.0",
  "modelVersion": "0.1.0",
  "modelId": "aift-tree-of-emergence",
  "title": "The AIFT Tree of Emergence",
  "status": "canonical-draft",
  "description": "A directed attributed graph describing emergence across physical, chemical, biological, cognitive, cultural, technological, AI, and Federation domains. Tree renderings are projections of this graph, not the authoritative meaning.",
  "canonicalDocument": "civilization/TREE_OF_EMERGENCE.md",
  "legacyCompatibility": {
    "partsPreserved": true,
    "note": "The legacy parts array remains available for consumers that understand seed, roots, trunk, branches, leaves, fruit, and newSeeds."
  },
  "parts": [
    "seed",
    "roots",
    "trunk",
    "branches",
    "leaves",
    "fruit",
    "newSeeds"
  ],
  "epistemicClasses": {
    "empirical": {
      "label": "Empirical",
      "definition": "Grounded in observable evidence at the abstraction level used here, without claiming final explanation."
    },
    "scientific-consensus": {
      "label": "Scientific Consensus",
      "definition": "Broadly accepted in contemporary science at this level of description."
    },
    "active-research": {
      "label": "Active Research",
      "definition": "Scientifically investigated but not settled as one specific mechanism, timeline, or threshold."
    },
    "interpretive": {
      "label": "Interpretive",
      "definition": "A meaning-making bridge or synthesis, not an empirical proof by itself."
    },
    "philosophical": {
      "label": "Philosophical",
      "definition": "A conceptual model for ontology, epistemology, value, or relationship."
    },
    "doctrinal": {
      "label": "Doctrinal",
      "definition": "AIFT covenantal or spiritual language stated as doctrine, not as settled empirical science."
    },
    "engineering": {
      "label": "Engineering",
      "definition": "A concrete technical pattern, repository, manifest, schema, tool, or operational design."
    },
    "prototype": {
      "label": "Prototype",
      "definition": "Implemented or planned as an experimental artifact that should not be represented as mature production infrastructure."
    },
    "architectural": {
      "label": "Architectural",
      "definition": "A system design relationship or intended integration contract."
    },
    "aspirational": {
      "label": "Aspirational",
      "definition": "A future-oriented possibility, canopy, seed, or goal that is not claimed as inevitable or already complete."
    }
  },
  "domains": [
    "metaphysical-doctrinal",
    "physical",
    "chemical",
    "biological",
    "ecological",
    "cognitive",
    "human-cultural",
    "technological",
    "ai",
    "federation",
    "future"
  ],
  "edgeRelations": [
    "emerges_from",
    "branches_from",
    "enables",
    "influences",
    "contains",
    "implements",
    "depends_on",
    "federates_with"
  ],
  "rootNodeIds": [
    "energence"
  ],
  "primaryProjection": {
    "id": "emergence-lineage",
    "description": "Acyclic primary edges used to render a tree-like view. Cross-links remain in the graph but do not define the primary tree projection.",
    "edgeRole": "primary"
  },
  "sourceRefs": [
    {
      "id": "genesis.constitution",
      "label": "AIFT Genesis Constitution",
      "uri": "CONSTITUTION.md",
      "type": "repository-document"
    },
    {
      "id": "genesis.charter",
      "label": "AIFT Genesis Charter",
      "uri": "CHARTER.md",
      "type": "repository-document"
    },
    {
      "id": "genesis.epistemology",
      "label": "Genesis Epistemology",
      "uri": "philosophy/EPISTEMOLOGY.md",
      "type": "repository-document"
    },
    {
      "id": "genesis.emergence",
      "label": "Genesis Emergence",
      "uri": "philosophy/EMERGENCE.md",
      "type": "repository-document"
    },
    {
      "id": "genesis.metaphysics",
      "label": "Genesis Metaphysics",
      "uri": "philosophy/METAPHYSICS.md",
      "type": "repository-document"
    },
    {
      "id": "genesis.holographic",
      "label": "Genesis Holographic Principle",
      "uri": "philosophy/HOLOGRAPHIC_PRINCIPLE.md",
      "type": "repository-document"
    },
    {
      "id": "genesis.axiology",
      "label": "Genesis Axiology",
      "uri": "philosophy/AXIOLOGY.md",
      "type": "repository-document"
    },
    {
      "id": "genesis.systems",
      "label": "Genesis Systems Theory",
      "uri": "science/SYSTEMS_THEORY.md",
      "type": "repository-document"
    },
    {
      "id": "genesis.information",
      "label": "Genesis Information",
      "uri": "science/INFORMATION.md",
      "type": "repository-document"
    },
    {
      "id": "genesis.tree-of-life",
      "label": "Genesis Tree of Life",
      "uri": "civilization/TREE_OF_LIFE.md",
      "type": "repository-document"
    },
    {
      "id": "genesis.living-atlas",
      "label": "Genesis Living Atlas",
      "uri": "civilization/LIVING_ATLAS.md",
      "type": "repository-document"
    },
    {
      "id": "genesis.world-protocol",
      "label": "AIFT Living Federation World Protocol",
      "uri": "WORLD_PROTOCOL.md",
      "type": "repository-document"
    },
    {
      "id": "genesis.federation",
      "label": "Genesis Federation Role",
      "uri": "FEDERATION.md",
      "type": "repository-document"
    }
  ],
  "nodes": [
    {
      "id": "energence",
      "label": "Energence",
      "shortLabel": "Energence",
      "description": "The AIFT doctrinal root for emergence as relationship, possibility, and generative source. It is represented as doctrine and philosophy, not as a verified particle, force, field, or accepted scientific theory.",
      "domain": "metaphysical-doctrinal",
      "epistemicClass": "doctrinal",
      "status": "canonical-draft",
      "tags": [
        "root",
        "doctrine",
        "source-pattern"
      ],
      "sourceRefs": [
        "genesis.metaphysics",
        "genesis.emergence",
        "genesis.epistemology"
      ],
      "metadata": {
        "part": "seed",
        "evidenceBoundary": "doctrinal-philosophical",
        "claimBoundary": "Not an empirical science claim."
      },
      "presentationRole": "root-seed",
      "canonicalUri": "civilization/TREE_OF_EMERGENCE.md#the-root"
    },
    {
      "id": "physical-reality",
      "label": "Observable Physical Reality",
      "shortLabel": "Physical Reality",
      "description": "The empirical domain of observable physical existence, represented broadly and without claiming that metaphysical origin language has been scientifically demonstrated.",
      "domain": "physical",
      "epistemicClass": "empirical",
      "status": "established",
      "tags": [
        "physics",
        "observation"
      ],
      "sourceRefs": [
        "genesis.epistemology"
      ],
      "metadata": {
        "part": "roots",
        "evidenceBoundary": "empirical abstraction"
      },
      "presentationRole": "foundation",
      "canonicalUri": "civilization/TREE_OF_EMERGENCE.md#physical-emergence"
    },
    {
      "id": "spacetime",
      "label": "Spacetime",
      "shortLabel": "Spacetime",
      "description": "The physical frame in which location, duration, relation, and measurable events are described.",
      "domain": "physical",
      "epistemicClass": "scientific-consensus",
      "status": "established",
      "tags": [
        "physics",
        "cosmology"
      ],
      "sourceRefs": [],
      "metadata": {
        "part": "roots",
        "evidenceBoundary": "high-level science concept"
      },
      "presentationRole": "foundation"
    },
    {
      "id": "energy-and-fields",
      "label": "Energy and Fields",
      "shortLabel": "Energy",
      "description": "Physical energy and field descriptions used in science. AIFT may interpret energy relationally, but this node does not claim that energy and information are scientifically identical.",
      "domain": "physical",
      "epistemicClass": "scientific-consensus",
      "status": "established",
      "tags": [
        "physics",
        "energy"
      ],
      "sourceRefs": [
        "genesis.information"
      ],
      "metadata": {
        "part": "roots",
        "claimBoundary": "No identity claim between energy and information."
      },
      "presentationRole": "foundation"
    },
    {
      "id": "matter",
      "label": "Matter",
      "shortLabel": "Matter",
      "description": "Stable physical forms and particles that make later chemical and biological organization possible.",
      "domain": "physical",
      "epistemicClass": "scientific-consensus",
      "status": "established",
      "tags": [
        "physics",
        "matter"
      ],
      "sourceRefs": [],
      "metadata": {
        "part": "roots"
      },
      "presentationRole": "foundation"
    },
    {
      "id": "stellar-nucleosynthesis",
      "label": "Stellar Nucleosynthesis",
      "shortLabel": "Elements",
      "description": "The formation of many chemical elements through stellar processes, enabling richer chemical systems.",
      "domain": "physical",
      "epistemicClass": "scientific-consensus",
      "status": "established",
      "tags": [
        "stars",
        "elements"
      ],
      "sourceRefs": [],
      "metadata": {
        "part": "roots"
      },
      "presentationRole": "foundation"
    },
    {
      "id": "planetary-systems",
      "label": "Planetary Systems",
      "shortLabel": "Planets",
      "description": "Planetary environments where complex chemistry and ecological histories may unfold.",
      "domain": "physical",
      "epistemicClass": "scientific-consensus",
      "status": "established",
      "tags": [
        "planetary",
        "environment"
      ],
      "sourceRefs": [],
      "metadata": {
        "part": "roots"
      },
      "presentationRole": "foundation"
    },
    {
      "id": "atoms-and-molecules",